{
  "schema": "vela.math.fc-audit.agent-receiver-output.v0.1",
  "fixture_id": "clean-source-faithful-min-modulus-4829",
  "condition": "same-inputs-plus-fc-pr-audit",
  "packet_root": "sha256:57d3fb334b9dc03a80b50f89fda9377aa7c2fa0c563573a532cc260a97317caa",
  "sender_output_sha256": "sha256:a24fb1fa8a75de5e2002569b7bf21ec099c18e1859a9b756be3ffcc49a337c65",
  "retained_verdict": "clean",
  "retained_issue_codes": [],
  "layered_summary": "Mechanical: the retained exact-head GitHub build observation and audit snapshot-identity check report pass, but this receiver did not independently execute them. Source fidelity: CLEAN for MinModulus.min_modulus; the exact head bytes state the documented positive-modulus form of Conjecture 1, and the retained source-author review chain covers that declaration. Artifact availability: the head source and audit inputs are content-addressed, while the separately declared solved-theorem proof is only identified by a commit-qualified external locator, without its bytes or content hash in this bundle. Community: PR 4829 was approved at the exact head and merged; those are observations only. Authority: none; no acceptance, Standing, Vela Verification, or Decision follows.",
  "reproduction_terminal_state": "scoped",
  "missing_provenance_fields": [
    "independent build execution record, toolchain/environment identity, and build-log bytes",
    "retained bytes and content hash for the external proof artifact at jarfo/min-modulus commit e7c78dd63955092b5f8d8a5fa826476337c0f4be",
    "GitHub cryptographic signature or equivalent authentication beyond retained acquisition receipts"
  ],
  "next_obligation": "To elevate scoped mechanical and external-artifact claims to reproduction, run the exact-head build in a recorded environment and retain the resulting logs; if the solved theorem's proof is to be assessed, also acquire and hash the commit-pinned proof bytes.",
  "unsupported_claims": [
    "The sender's unqualified \"artifact_availability: exact\" is too broad: exact identity is supplied for the head source and retained audit artifacts, but not for the separately declared external proof artifact's bytes."
  ],
  "authority_effect": "none",
  "does_not_establish": [
    "mathematical truth of Conjecture 1",
    "acceptance or Standing",
    "Vela Verification or Decision",
    "source fidelity beyond MinModulus.min_modulus",
    "proof correctness of the separately declared solved theorem",
    "that unlisted checks ran",
    "independent reproduction of the exact-head build"
  ],
  "confidence": "high"
}
