{
  "schema": "vela.math.fc-audit.agent-receiver-output.v0.1",
  "fixture_id": "clean-source-faithful-min-modulus-4829",
  "condition": "plain-git-and-current-review-artifacts",
  "packet_root": "sha256:34f9ce1e77b28e8ebcd9a49f57f4e976a890eabda546594d24ae588b465554fc",
  "sender_output_sha256": "sha256:4a0993eb0c1bbb16fbc47e6d56e0b8b99707cc30eec4dbc8208f0eff87b4f3d8",
  "retained_verdict": "clean",
  "retained_issue_codes": [],
  "layered_summary": "Mechanical status: the retained GitHub observation records Build project job 93244176232 succeeding on the exact head 0f8d60f1a5811eb00ad9f12cf8031ee5c1cc215c; without logs, workflow/toolchain provenance, or execution access, this is scoped attestation rather than an independently reproduced build. Source fidelity: the exact blob 4c68a8c3788f805e29588bfefdac1fec079e9193 supports the sender's clean reading against the supplied documentation—the answer binder covers the complete lower-bound proposition, and the 2 ≤ n and 0 < N conditions address the documented boundary cases without vacuity. Artifact availability: the changed Lean source is supplied exactly; the complementary theorem has a commit-pinned external proof locator, but its proof bytes and verification result are not supplied. Community status: one collaborator approval and the subsequent merge are recorded observations only. Authority: every artifact expressly has authority effect none.",
  "reproduction_terminal_state": "scoped",
  "missing_provenance_fields": [
    "Build job 93244176232 logs, workflow definition, runner environment, and Lean/toolchain identities needed for independent reproduction",
    "Content bytes and digest for the commit-pinned external proof artifact MinModulus/UniqueSums.lean at e7c78dd63955092b5f8d8a5fa826476337c0f4be",
    "Independent verification record for the external proof artifact",
    "Immutable source-paper text or digest for comparison beyond the supplied Lean file's documentation"
  ],
  "next_obligation": "If independent reproduction or external-source verification is required, obtain and hash the pinned proof and paper bytes and rerun the exact-head build with recorded workflow and toolchain provenance.",
  "unsupported_claims": [],
  "authority_effect": "none",
  "does_not_establish": [
    "The observed successful build establishes neither source-statement fidelity nor mathematical truth.",
    "The supplied source-fidelity comparison independently establishes only agreement with the documentation present in the exact Lean blob, not with unavailable paper bytes.",
    "The commit-pinned proof locator does not establish that the external proof bytes were retrieved or independently checked in this task context.",
    "Approval, closure, and merge do not establish acceptance, Formal Conjectures Standing, or any Vela Verification, Decision, or Standing.",
    "This receiver review has no authority effect."
  ],
  "confidence": "high"
}
